{
  "apiVersion": "v1",
  "kind": "BenchmarkDefinition",
  "metadata": {
    "name": "esc",
    "labels": { "distribution": "ubuntu", "distributionVersion": "22.04", "framework": "cis" },
    "annotations": { "benchmarkVersion": "v2.0.0" }
  },
  "spec": {
    "version": "1.0.0",
    "rules": [
      {
        "ruleName": "EscapeStress",
        "title": "9.9.9 Escape \"Stress\" A\\B\nC\tD \u00e9A",
        "tags": [],
        "metadata": {
          "description": "A\\B\"C\\\\D\nE\\\"F",
          "rationale": "r",
          "fixtext": "f",
          "severity": "Warning",
          "references": "x"
        },
        "payload": {
          "audit": {
            "Regex": {
              "pattern": "a\\.b\"c\\\\d"
            }
          },
          "parameters": {}
        },
        "id": "9.9.9",
        "ruleId": "escaped-fields-rule-1"
      }
    ]
  }
}
