{
  "apiVersion": "v1",
  "kind": "BenchmarkDefinition",
  "metadata": {
    "name": "cis_ubuntu_22.04_2.0.0",
    "labels": { "distribution": "ubuntu", "distributionVersion": "22.04", "framework": "cis" },
    "annotations": { "benchmarkVersion": "v2.0.0" }
  },
  "spec": {
    "version": "1.0.0",
    "rules": [
      {
        "ruleName": "RuleA",
        "title": "1.1.1 Rule A",
        "tags": [],
        "metadata": {
          "description": "d",
          "rationale": "r",
          "fixtext": "f",
          "severity": "Warning",
          "references": "x"
        },
        "payload": {
          "audit": {},
          "parameters": {}
        },
        "id": "1.1.1",
        "ruleId": "rule-a"
      },
      {
        "ruleName": "RuleB",
        "title": "1.1.2 Rule B",
        "tags": [],
        "metadata": {
          "description": "d",
          "rationale": "r",
          "fixtext": "f",
          "severity": "Warning",
          "references": "x"
        },
        "payload": {
          "audit": {},
          "parameters": {}
        },
        "id": "1.1.2",
        "ruleId": "rule-b"
      }
    ]
  }
}
