{
  "apiVersion": "v1",
  "kind": "BenchmarkDefinition",
  "metadata": {
    "name": "cis_ubuntu_22.04_2.0.0",
    "labels": { "distribution": "ubuntu", "distributionVersion": "22.04", "framework": "cis" },
    "annotations": { "benchmarkVersion": "v2.0.0" }
  },
  "spec": {
    "version": "1.0.0",
    "rules": [
      {
        "ruleName": "EnsureCramfsKernelModuleIsNotAvailable",
        "title": "1.1.1.1 Ensure cramfs kernel module is not available",
        "tags": ["level:l1"],
        "metadata": {
          "description": "d",
          "rationale": "r",
          "fixtext": "f",
          "severity": "Warning",
          "references": "x"
        },
        "payload": {
          "audit": {
            "KernelModuleUnavailable": {
              "moduleName": "cramfs"
            }
          },
          "parameters": {}
        },
        "id": "1.1.1.1",
        "ruleId": "2b568469-ea61-c184-66ba-db6720414ddd"
      }
    ]
  }
}
