{
  "apiVersion": "v1",
  "kind": "BenchmarkDefinition",
  "metadata": {
    "name": "cis_azurelinux_3_1.0.0",
    "labels": { "distribution": "azurelinux", "distributionVersion": "3\\.?", "framework": "cis" },
    "annotations": { "benchmarkVersion": "v1.0.0" }
  },
  "spec": {
    "version": "1.0.0",
    "rules": [
      {
        "ruleName": "EscapedGlob",
  "title": "3.1.2.4 Escaped Glob Version",
        "tags": [],
        "metadata": {
          "description": "d",
          "rationale": "r",
          "fixtext": "f",
          "severity": "Warning",
          "references": "x"
        },
        "payload": {
          "audit": {},
          "parameters": {}
        },
        "id": "3.1.2.4",
        "ruleId": "escaped-version-rule-1"
      }
    ]
  }
}
