{
  "apiVersion": "v1",
  "kind": "BenchmarkDefinition",
  "metadata": {
    "name": "cis_ubuntu_22.04_2.0.0",
    "labels": { "distribution": "ubuntu", "distributionVersion": "22.04", "framework": "cis" },
    "annotations": { "benchmarkVersion": "v2.0.0" }
  },
  "spec": {
    "version": "1.0.0",
    "rules": [
      {
        "ruleName": "WithParameters",
        "title": "2.1.1 Sample With Parameters",
        "tags": [],
        "metadata": {
          "description": "d",
          "rationale": "r",
          "fixtext": "f",
          "severity": "Warning",
          "references": "x"
        },
        "payload": {
          "audit": {
            "FilePermissions": {
              "filename": "/etc/shadow",
              "mask": "$mask"
            }
          },
          "parameters": {
            "mask": "0600"
          }
        },
        "parameterMetadata": {
          "mask": {
            "type": "string",
            "default": "0600",
            "displayName": "Permission mask"
          }
        },
        "id": "2.1.1",
        "ruleId": "parameters-rule-1"
      }
    ]
  }
}
